{
  "$schema": "https://json-schema.org/draft/2020-12/schema",
  "additionalProperties": false,
  "properties": {
    "edges": {
      "items": {
        "additionalProperties": false,
        "properties": {
          "from": {
            "type": "string"
          },
          "source": {
            "anyOf": [
              {
                "additionalProperties": false,
                "properties": {
                  "end": {
                    "type": "integer"
                  },
                  "line": {
                    "type": "integer"
                  },
                  "path": {
                    "type": "string"
                  },
                  "sha256": {
                    "pattern": "^[0-9a-f]{64}$",
                    "type": "string"
                  }
                },
                "required": [
                  "path",
                  "line",
                  "end",
                  "sha256"
                ],
                "type": "object"
              },
              {
                "additionalProperties": false,
                "properties": {
                  "doc": {
                    "type": "string"
                  },
                  "quote": {
                    "type": "string"
                  },
                  "section": {
                    "type": "string"
                  }
                },
                "required": [
                  "doc",
                  "section"
                ],
                "type": "object"
              }
            ]
          },
          "to": {
            "type": "string"
          },
          "verb": {
            "type": "string"
          }
        },
        "required": [
          "from",
          "to",
          "verb"
        ],
        "type": "object"
      },
      "type": "array"
    },
    "layer": {
      "const": "tests"
    },
    "provenance": {
      "additionalProperties": false,
      "properties": {
        "commit": {
          "type": "string"
        },
        "inputs": {
          "additionalProperties": {
            "pattern": "^[0-9a-f]{64}$",
            "type": "string"
          },
          "type": "object"
        },
        "tool": {
          "type": "string"
        },
        "tool_version": {
          "type": "string"
        },
        "tree_sha256": {
          "pattern": "^[0-9a-f]{64}$",
          "type": "string"
        }
      },
      "required": [
        "tool",
        "tool_version",
        "commit",
        "tree_sha256",
        "inputs"
      ],
      "type": "object"
    },
    "tests": {
      "items": {
        "additionalProperties": false,
        "properties": {
          "id": {
            "pattern": "^[A-Za-z0-9][A-Za-z0-9._/:@-]*$",
            "type": "string"
          },
          "imports": {
            "items": {
              "type": "string"
            },
            "type": "array"
          },
          "kind": {
            "type": "string"
          },
          "name": {
            "type": "string"
          },
          "path": {
            "type": "string"
          },
          "properties": {
            "type": "object"
          },
          "proposed": {
            "additionalProperties": false,
            "properties": {
              "date": {
                "type": "string"
              },
              "model": {
                "type": "string"
              },
              "prompt": {
                "type": "string"
              }
            },
            "required": [
              "model",
              "prompt",
              "date"
            ],
            "type": "object"
          },
          "satisfies": {
            "items": {
              "type": "string"
            },
            "type": "array"
          },
          "source": {
            "anyOf": [
              {
                "additionalProperties": false,
                "properties": {
                  "end": {
                    "type": "integer"
                  },
                  "line": {
                    "type": "integer"
                  },
                  "path": {
                    "type": "string"
                  },
                  "sha256": {
                    "pattern": "^[0-9a-f]{64}$",
                    "type": "string"
                  }
                },
                "required": [
                  "path",
                  "line",
                  "end",
                  "sha256"
                ],
                "type": "object"
              },
              {
                "additionalProperties": false,
                "properties": {
                  "doc": {
                    "type": "string"
                  },
                  "quote": {
                    "type": "string"
                  },
                  "section": {
                    "type": "string"
                  }
                },
                "required": [
                  "doc",
                  "section"
                ],
                "type": "object"
              }
            ]
          },
          "tests": {
            "type": "integer"
          }
        },
        "required": [
          "id",
          "name",
          "source",
          "path",
          "kind"
        ],
        "type": "object"
      },
      "type": "array"
    },
    "untested": {
      "items": {
        "type": "string"
      },
      "type": "array"
    }
  },
  "required": [
    "layer",
    "provenance",
    "tests"
  ],
  "title": "review/graph/tests.json",
  "type": "object"
}
