{
  "edges": [
    {
      "from": "test:tests/build/test_chrome_in_every_page.py:test_canonical_matches_the_page_location",
      "source": {
        "end": 57,
        "line": 57,
        "path": "tests/build/test_chrome_in_every_page.py",
        "sha256": "ab218e6cc6c006695da0d82ad8efa182e7a3d29c0ab529df6baf7274ac0083e6"
      },
      "to": "module:admin/build/chrome.py",
      "verb": "tests"
    },
    {
      "from": "test:tests/build/test_chrome_in_every_page.py:test_canonical_matches_the_page_location",
      "source": {
        "end": 57,
        "line": 57,
        "path": "tests/build/test_chrome_in_every_page.py",
        "sha256": "ab218e6cc6c006695da0d82ad8efa182e7a3d29c0ab529df6baf7274ac0083e6"
      },
      "to": "module:admin/build/pages.py",
      "verb": "tests"
    },
    {
      "from": "test:tests/build/test_chrome_in_every_page.py:test_every_badge_equals_version_txt",
      "source": {
        "end": 50,
        "line": 50,
        "path": "tests/build/test_chrome_in_every_page.py",
        "sha256": "e0d0f53891a7b6ad482ef7ca55d79dd840e76212de756f6c8348a742d1758ee0"
      },
      "to": "module:admin/build/chrome.py",
      "verb": "tests"
    },
    {
      "from": "test:tests/build/test_chrome_in_every_page.py:test_every_badge_equals_version_txt",
      "source": {
        "end": 50,
        "line": 50,
        "path": "tests/build/test_chrome_in_every_page.py",
        "sha256": "e0d0f53891a7b6ad482ef7ca55d79dd840e76212de756f6c8348a742d1758ee0"
      },
      "to": "module:admin/build/pages.py",
      "verb": "tests"
    },
    {
      "from": "test:tests/build/test_chrome_in_every_page.py:test_every_page_has_the_chrome",
      "source": {
        "end": 32,
        "line": 32,
        "path": "tests/build/test_chrome_in_every_page.py",
        "sha256": "2f2e248b2b7e2d678fcc7bf1fddf40501c71cd1fe8b2f9f047997eb09e48473e"
      },
      "to": "module:admin/build/chrome.py",
      "verb": "tests"
    },
    {
      "from": "test:tests/build/test_chrome_in_every_page.py:test_every_page_has_the_chrome",
      "source": {
        "end": 32,
        "line": 32,
        "path": "tests/build/test_chrome_in_every_page.py",
        "sha256": "2f2e248b2b7e2d678fcc7bf1fddf40501c71cd1fe8b2f9f047997eb09e48473e"
      },
      "to": "module:admin/build/pages.py",
      "verb": "tests"
    },
    {
      "from": "test:tests/build/test_chrome_in_every_page.py:test_no_inline_script_or_style",
      "source": {
        "end": 65,
        "line": 65,
        "path": "tests/build/test_chrome_in_every_page.py",
        "sha256": "974aa2e8d7027cb6f2364a28184533d42806e3b748b8d1ce856af1836c1bea54"
      },
      "to": "module:admin/build/chrome.py",
      "verb": "tests"
    },
    {
      "from": "test:tests/build/test_chrome_in_every_page.py:test_no_inline_script_or_style",
      "source": {
        "end": 65,
        "line": 65,
        "path": "tests/build/test_chrome_in_every_page.py",
        "sha256": "974aa2e8d7027cb6f2364a28184533d42806e3b748b8d1ce856af1836c1bea54"
      },
      "to": "module:admin/build/pages.py",
      "verb": "tests"
    },
    {
      "from": "test:tests/build/test_chrome_in_every_page.py:test_there_are_pages",
      "source": {
        "end": 28,
        "line": 28,
        "path": "tests/build/test_chrome_in_every_page.py",
        "sha256": "a0462bf12ff895d7afe2117b81b82e1911ba95aa01888ade0e62f58d92403fed"
      },
      "to": "module:admin/build/chrome.py",
      "verb": "tests"
    },
    {
      "from": "test:tests/build/test_chrome_in_every_page.py:test_there_are_pages",
      "source": {
        "end": 28,
        "line": 28,
        "path": "tests/build/test_chrome_in_every_page.py",
        "sha256": "a0462bf12ff895d7afe2117b81b82e1911ba95aa01888ade0e62f58d92403fed"
      },
      "to": "module:admin/build/pages.py",
      "verb": "tests"
    },
    {
      "from": "test:tests/build/test_claims.py:test_brief_sections_match_the_markdown",
      "source": {
        "end": 90,
        "line": 90,
        "path": "tests/build/test_claims.py",
        "sha256": "63d237c6769cb48ec5e0e473c44fbc41c358357576c1fd9eca44adabbde9dd80"
      },
      "to": "module:admin/build/pages.py",
      "verb": "tests"
    },
    {
      "from": "test:tests/build/test_claims.py:test_claims_layer_is_current_and_strict",
      "source": {
        "end": 58,
        "line": 58,
        "path": "tests/build/test_claims.py",
        "sha256": "d5f5ab5c789664871ca4cccf5bc35ef85b29f9ecb96607e2eb9e2b1c5db26f16"
      },
      "to": "module:admin/build/pages.py",
      "verb": "tests"
    },
    {
      "from": "test:tests/build/test_claims.py:test_every_feature_is_a_claim_with_evidence",
      "source": {
        "end": 41,
        "line": 41,
        "path": "tests/build/test_claims.py",
        "sha256": "2fa189e599987304ea618af7add366aa9f3a9332efdafe7a471dcf6a98a780ac"
      },
      "to": "module:admin/build/pages.py",
      "verb": "tests"
    },
    {
      "from": "test:tests/build/test_claims.py:test_every_status_chip_links_to_its_claim",
      "source": {
        "end": 69,
        "line": 69,
        "path": "tests/build/test_claims.py",
        "sha256": "039e2f21996ae1c7e11bb50380d1a095af468311f717382d8f5f6d0241d9641a"
      },
      "to": "module:admin/build/pages.py",
      "verb": "tests"
    },
    {
      "from": "test:tests/build/test_claims.py:test_locations_link_into_the_source_view",
      "source": {
        "end": 83,
        "line": 83,
        "path": "tests/build/test_claims.py",
        "sha256": "73dd2bf65897e01ac94058f2fc24500e26421b808c639568059e7ce303a13a05"
      },
      "to": "module:admin/build/pages.py",
      "verb": "tests"
    },
    {
      "from": "test:tests/build/test_claims.py:test_navigator_shell_has_the_regions",
      "source": {
        "end": 115,
        "line": 115,
        "path": "tests/build/test_claims.py",
        "sha256": "98a4d46ce83f6bca1db83581e6b480cb99b7f2d0621720e461f5a1737a15b694"
      },
      "to": "module:admin/build/pages.py",
      "verb": "tests"
    },
    {
      "from": "test:tests/build/test_claims.py:test_releases_carry_their_records",
      "source": {
        "end": 104,
        "line": 104,
        "path": "tests/build/test_claims.py",
        "sha256": "cc4c49b8f96d4249d3824742484c1c9623df0484e578186ce432ef48db465753"
      },
      "to": "module:admin/build/pages.py",
      "verb": "tests"
    },
    {
      "from": "test:tests/build/test_claims.py:test_shipped_claims_end_on_an_anchor",
      "source": {
        "end": 48,
        "line": 48,
        "path": "tests/build/test_claims.py",
        "sha256": "db4d2bca0942c4f40ba38b49233e08ca00250df452359f91441162f254631c73"
      },
      "to": "module:admin/build/pages.py",
      "verb": "tests"
    },
    {
      "from": "test:tests/build/test_html_to_md.py:test_code",
      "source": {
        "end": 39,
        "line": 39,
        "path": "tests/build/test_html_to_md.py",
        "sha256": "3aa0041781f53f591089fa2aeed013200e54828311ae3f4f4f343edba87dc071"
      },
      "to": "module:admin/build/html_to_md.py",
      "verb": "tests"
    },
    {
      "from": "test:tests/build/test_html_to_md.py:test_headings_and_paragraphs",
      "source": {
        "end": 23,
        "line": 23,
        "path": "tests/build/test_html_to_md.py",
        "sha256": "486981dd85f5c4f66417710e7e725ece9f8bbda01cd3799e07699c86e14b863c"
      },
      "to": "module:admin/build/html_to_md.py",
      "verb": "tests"
    },
    {
      "from": "test:tests/build/test_html_to_md.py:test_links_point_at_twins",
      "source": {
        "end": 27,
        "line": 27,
        "path": "tests/build/test_html_to_md.py",
        "sha256": "78983c2f02bec003b4abb9a5ad1ede4315f3a2519259fc3c4ec50922825a2306"
      },
      "to": "module:admin/build/html_to_md.py",
      "verb": "tests"
    },
    {
      "from": "test:tests/build/test_html_to_md.py:test_lists",
      "source": {
        "end": 31,
        "line": 31,
        "path": "tests/build/test_html_to_md.py",
        "sha256": "a720ffbbadd6dcf11a09e090f24368865ce8a96ec0f6fea7b55fec60701867a8"
      },
      "to": "module:admin/build/html_to_md.py",
      "verb": "tests"
    },
    {
      "from": "test:tests/build/test_html_to_md.py:test_spans_and_scripts",
      "source": {
        "end": 43,
        "line": 43,
        "path": "tests/build/test_html_to_md.py",
        "sha256": "d5778ed3b538ca3c125aff3b092e20c75123cbd65b4a06ccdd379c4bdeb17345"
      },
      "to": "module:admin/build/html_to_md.py",
      "verb": "tests"
    },
    {
      "from": "test:tests/build/test_html_to_md.py:test_table",
      "source": {
        "end": 35,
        "line": 35,
        "path": "tests/build/test_html_to_md.py",
        "sha256": "46b83afb509e45ba387b0b3da3ef9050fded397866e66a0b8b3198ebfc02c491"
      },
      "to": "module:admin/build/html_to_md.py",
      "verb": "tests"
    },
    {
      "from": "test:tests/build/test_md_to_html.py:test_code_fence_and_blockquote",
      "source": {
        "end": 54,
        "line": 54,
        "path": "tests/build/test_md_to_html.py",
        "sha256": "97331f3206a86d4697451de32c85ae69eb2cbc5dfe18fcd1fa0c24a0c10ae5a3"
      },
      "to": "module:admin/build/md_to_html.py",
      "verb": "tests"
    },
    {
      "from": "test:tests/build/test_md_to_html.py:test_headings_get_github_ids",
      "source": {
        "end": 25,
        "line": 25,
        "path": "tests/build/test_md_to_html.py",
        "sha256": "4a2dd3d9edabd7a9fcb58e985b14d138d81771e7de1ca54268fa3a28b506a5c8"
      },
      "to": "module:admin/build/md_to_html.py",
      "verb": "tests"
    },
    {
      "from": "test:tests/build/test_md_to_html.py:test_html_is_escaped",
      "source": {
        "end": 35,
        "line": 35,
        "path": "tests/build/test_md_to_html.py",
        "sha256": "83d39495acdc411ec225959306a6e5ed324f3da03f162e1efc95c56fcbdf975f"
      },
      "to": "module:admin/build/md_to_html.py",
      "verb": "tests"
    },
    {